{
  "$schema": "../../../../schemas/design-snapshot-manifest.schema.json",
  "schema_version": "starlight.design_snapshot_manifest.v1",
  "snapshot_id": "snapshot.league-universe.pricing.browser-observed.20260902t211549z",
  "target_id": "league-universe",
  "surface_id": "pricing",
  "captured_at": "2026-09-02T21:15:49.912Z",
  "locale": "en",
  "url": "https://universe.leagueoflegends.com/en_US/comic/",
  "route": "/en_US/comic/",
  "viewport": {
    "name": "browser-observed",
    "width": 1363,
    "height": 936,
    "dpr": 1
  },
  "tool": {
    "name": "codex-cloud-browser",
    "version": "2026-09-02",
    "method": "browser"
  },
  "response": {
    "status": null,
    "status_source": "browser-api-unavailable",
    "final_url": "https://universe.leagueoflegends.com/en_US/comic/",
    "title": "Universe of League of Legends",
    "observed_page_state": "loaded"
  },
  "artifacts": {
    "screenshot": {
      "sha256": "65cd5a7bcbea597f6bc7c5434d87f36dc9e0e9b58fb65986f5c4be621dfa7789",
      "bytes": 9987,
      "mime": "image/jpeg",
      "width": 1348,
      "height": 926,
      "content_address": "sha256/65/65cd5a7bcbea597f6bc7c5434d87f36dc9e0e9b58fb65986f5c4be621dfa7789.jpg",
      "storage_status": "pending-private-storage"
    },
    "html": {
      "sha256": "3cf81b9c24ec3462d551bccce0fa2e541dfd2686e501834d60f23880cbffa2ff",
      "bytes": 200014,
      "mime": "text/html",
      "content_address": "sha256/3c/3cf81b9c24ec3462d551bccce0fa2e541dfd2686e501834d60f23880cbffa2ff.html",
      "storage_status": "pending-private-storage"
    }
  },
  "content_hash": "3cf81b9c24ec3462d551bccce0fa2e541dfd2686e501834d60f23880cbffa2ff",
  "rights": {
    "state": "third-party-reference-only",
    "allowed_use": "Abstract research findings and original pattern synthesis only.",
    "prohibited_use": "Marks, assets, font files, source code, distinctive compositions, and copied components.",
    "reviewed_at": "2026-09-02"
  },
  "provenance": {
    "source_owner": "Riot Games, Inc.",
    "captured_by": "Codex design-research operator",
    "capture_purpose": "design-research-reference-only"
  },
  "inspection": {
    "menu_state": "not-tested",
    "motion_state": "observed",
    "reduced_motion": "not-tested",
    "accessibility_structure": "observed"
  }
}
