{
  "$schema": "../../../../schemas/design-snapshot-manifest.schema.json",
  "schema_version": "starlight.design_snapshot_manifest.v1",
  "snapshot_id": "snapshot.othership.pricing.browser-observed.20260902t211916z",
  "target_id": "othership",
  "surface_id": "pricing",
  "captured_at": "2026-09-02T21:19:16.191Z",
  "locale": "en",
  "url": "https://www.othership.us/buy-a-pass",
  "route": "/buy-a-pass",
  "viewport": {
    "name": "browser-observed",
    "width": 1363,
    "height": 936,
    "dpr": 1
  },
  "tool": {
    "name": "codex-cloud-browser",
    "version": "2026-09-02",
    "method": "browser"
  },
  "response": {
    "status": null,
    "status_source": "browser-api-unavailable",
    "final_url": "https://www.othership.us/buy-a-pass",
    "title": "Buy a Pass | Othership",
    "observed_page_state": "loaded"
  },
  "artifacts": {
    "screenshot": {
      "sha256": "09185c9ceaf57cb4f2c2b40f2942ee23c2a04e19dd9868434458aa9dd175c376",
      "bytes": 73270,
      "mime": "image/jpeg",
      "width": 1353,
      "height": 929,
      "content_address": "sha256/09/09185c9ceaf57cb4f2c2b40f2942ee23c2a04e19dd9868434458aa9dd175c376.jpg",
      "storage_status": "pending-private-storage"
    },
    "html": {
      "sha256": "165f56191e32e3512a6a92804c9ba93d97ce974349e4c2b72a41ab5ebbec3726",
      "bytes": 177955,
      "mime": "text/html",
      "content_address": "sha256/16/165f56191e32e3512a6a92804c9ba93d97ce974349e4c2b72a41ab5ebbec3726.html",
      "storage_status": "pending-private-storage"
    }
  },
  "content_hash": "165f56191e32e3512a6a92804c9ba93d97ce974349e4c2b72a41ab5ebbec3726",
  "rights": {
    "state": "third-party-reference-only",
    "allowed_use": "Abstract research findings and original pattern synthesis only.",
    "prohibited_use": "Marks, assets, font files, source code, distinctive compositions, and copied components.",
    "reviewed_at": "2026-09-02"
  },
  "provenance": {
    "source_owner": "Othership",
    "captured_by": "Codex design-research operator",
    "capture_purpose": "design-research-reference-only"
  },
  "inspection": {
    "menu_state": "not-tested",
    "motion_state": "observed",
    "reduced_motion": "not-tested",
    "accessibility_structure": "observed"
  }
}
