{
  "$schema": "../../../../schemas/design-snapshot-manifest.schema.json",
  "schema_version": "starlight.design_snapshot_manifest.v1",
  "snapshot_id": "snapshot.raycast.product-overview.browser-observed.20260902t212202z",
  "target_id": "raycast",
  "surface_id": "product-overview",
  "captured_at": "2026-09-02T21:22:02.580Z",
  "locale": "en",
  "url": "https://www.raycast.com/store",
  "route": "/store",
  "viewport": {
    "name": "browser-observed",
    "width": 1363,
    "height": 936,
    "dpr": 1
  },
  "tool": {
    "name": "codex-cloud-browser",
    "version": "2026-09-02",
    "method": "browser"
  },
  "response": {
    "status": null,
    "status_source": "browser-api-unavailable",
    "final_url": "https://www.raycast.com/store",
    "title": "Raycast - Store",
    "observed_page_state": "loaded"
  },
  "artifacts": {
    "screenshot": {
      "sha256": "47c8ff6676968add909390bc9eddbbbff061f799c522000070f96b071b9763e7",
      "bytes": 35683,
      "mime": "image/jpeg",
      "width": 1348,
      "height": 926,
      "content_address": "sha256/47/47c8ff6676968add909390bc9eddbbbff061f799c522000070f96b071b9763e7.jpg",
      "storage_status": "pending-private-storage"
    },
    "html": {
      "sha256": "9b218bbb4994d1994ad7fe1a8d0a264fda1f77ce10fd117e70c572f66c6c5af2",
      "bytes": 200124,
      "mime": "text/html",
      "content_address": "sha256/9b/9b218bbb4994d1994ad7fe1a8d0a264fda1f77ce10fd117e70c572f66c6c5af2.html",
      "storage_status": "pending-private-storage"
    }
  },
  "content_hash": "9b218bbb4994d1994ad7fe1a8d0a264fda1f77ce10fd117e70c572f66c6c5af2",
  "rights": {
    "state": "third-party-reference-only",
    "allowed_use": "Abstract research findings and original pattern synthesis only.",
    "prohibited_use": "Marks, assets, font files, source code, distinctive compositions, and copied components.",
    "reviewed_at": "2026-09-02"
  },
  "provenance": {
    "source_owner": "Raycast Technologies Ltd.",
    "captured_by": "Codex design-research operator",
    "capture_purpose": "design-research-reference-only"
  },
  "inspection": {
    "menu_state": "not-tested",
    "motion_state": "observed",
    "reduced_motion": "not-tested",
    "accessibility_structure": "observed"
  }
}
