{
  "$schema": "../../../../schemas/design-snapshot-manifest.schema.json",
  "schema_version": "starlight.design_snapshot_manifest.v1",
  "snapshot_id": "snapshot.cosmos.product-overview.browser-observed.20260902t210743z",
  "target_id": "cosmos",
  "surface_id": "product-overview",
  "captured_at": "2026-09-02T21:07:43.230Z",
  "locale": "en",
  "url": "https://www.cosmos.so/explore",
  "route": "/explore",
  "viewport": {
    "name": "browser-observed",
    "width": 1363,
    "height": 936,
    "dpr": 1
  },
  "tool": {
    "name": "codex-cloud-browser",
    "version": "2026-09-02",
    "method": "browser"
  },
  "response": {
    "status": null,
    "status_source": "browser-api-unavailable",
    "final_url": "https://www.cosmos.so/explore",
    "title": "Featured / Explore / Cosmos",
    "observed_page_state": "loaded"
  },
  "artifacts": {
    "screenshot": {
      "sha256": "ed1a450b1b1fc4da87d1e31c0cf80bd532cd95e0fc7ccb1235eb3fe9814779ae",
      "bytes": 86706,
      "mime": "image/jpeg",
      "width": 1353,
      "height": 929,
      "content_address": "sha256/ed/ed1a450b1b1fc4da87d1e31c0cf80bd532cd95e0fc7ccb1235eb3fe9814779ae.jpg",
      "storage_status": "pending-private-storage"
    },
    "html": {
      "sha256": "76fb8cd97370a8d06ef9a019459e36382f778425fa219da0c33b8bcd5dd5358f",
      "bytes": 200059,
      "mime": "text/html",
      "content_address": "sha256/76/76fb8cd97370a8d06ef9a019459e36382f778425fa219da0c33b8bcd5dd5358f.html",
      "storage_status": "pending-private-storage"
    }
  },
  "content_hash": "76fb8cd97370a8d06ef9a019459e36382f778425fa219da0c33b8bcd5dd5358f",
  "rights": {
    "state": "third-party-reference-only",
    "allowed_use": "Abstract research findings and original pattern synthesis only.",
    "prohibited_use": "Marks, assets, font files, source code, distinctive compositions, and copied components.",
    "reviewed_at": "2026-09-02"
  },
  "provenance": {
    "source_owner": "Cosmos",
    "captured_by": "Codex design-research operator",
    "capture_purpose": "design-research-reference-only"
  },
  "inspection": {
    "menu_state": "not-tested",
    "motion_state": "observed",
    "reduced_motion": "not-tested",
    "accessibility_structure": "observed"
  }
}
