{
  "$schema": "../../../../schemas/design-snapshot-manifest.schema.json",
  "schema_version": "starlight.design_snapshot_manifest.v1",
  "snapshot_id": "snapshot.runway.pricing.browser-observed.20260902t210626z",
  "target_id": "runway",
  "surface_id": "pricing",
  "captured_at": "2026-09-02T21:06:26.305Z",
  "locale": "en",
  "url": "https://runway.com/pricing",
  "route": "/pricing",
  "viewport": {
    "name": "browser-observed",
    "width": 1363,
    "height": 936,
    "dpr": 1
  },
  "tool": {
    "name": "codex-cloud-browser",
    "version": "2026-09-02",
    "method": "browser"
  },
  "response": {
    "status": null,
    "status_source": "browser-api-unavailable",
    "final_url": "https://runway.com/pricing",
    "title": "AI Image and Video Pricing from $12/month | Runway AI",
    "observed_page_state": "loaded"
  },
  "artifacts": {
    "screenshot": {
      "sha256": "0fac1136dd8a53f4c55076d4a211f44c6da22e03204fdd2f2d1f2721b61f9f35",
      "bytes": 88407,
      "mime": "image/jpeg",
      "width": 1348,
      "height": 926,
      "content_address": "sha256/0f/0fac1136dd8a53f4c55076d4a211f44c6da22e03204fdd2f2d1f2721b61f9f35.jpg",
      "storage_status": "pending-private-storage"
    },
    "html": {
      "sha256": "392d78c46c3b2b7b03bdead732c2658a942d9eadf6a667595f161e5ddc6a8d42",
      "bytes": 200061,
      "mime": "text/html",
      "content_address": "sha256/39/392d78c46c3b2b7b03bdead732c2658a942d9eadf6a667595f161e5ddc6a8d42.html",
      "storage_status": "pending-private-storage"
    }
  },
  "content_hash": "392d78c46c3b2b7b03bdead732c2658a942d9eadf6a667595f161e5ddc6a8d42",
  "rights": {
    "state": "third-party-reference-only",
    "allowed_use": "Abstract research findings and original pattern synthesis only.",
    "prohibited_use": "Marks, assets, font files, source code, distinctive compositions, and copied components.",
    "reviewed_at": "2026-09-02"
  },
  "provenance": {
    "source_owner": "Runway AI, Inc.",
    "captured_by": "Codex design-research operator",
    "capture_purpose": "design-research-reference-only"
  },
  "inspection": {
    "menu_state": "not-tested",
    "motion_state": "observed",
    "reduced_motion": "not-tested",
    "accessibility_structure": "observed"
  }
}
