{
  "$schema": "../../../../schemas/design-snapshot-manifest.schema.json",
  "schema_version": "starlight.design_snapshot_manifest.v1",
  "snapshot_id": "snapshot.maven.proof.browser-observed.20260902t211943z",
  "target_id": "maven",
  "surface_id": "proof",
  "captured_at": "2026-09-02T21:19:43.982Z",
  "locale": "en",
  "url": "https://maven.com/about",
  "route": "/about",
  "viewport": {
    "name": "browser-observed",
    "width": 1363,
    "height": 936,
    "dpr": 1
  },
  "tool": {
    "name": "codex-cloud-browser",
    "version": "2026-09-02",
    "method": "browser"
  },
  "response": {
    "status": null,
    "status_source": "browser-api-unavailable",
    "final_url": "https://maven.com/about",
    "title": "About Maven: Helping experts make an impact teaching what they love.",
    "observed_page_state": "loaded"
  },
  "artifacts": {
    "screenshot": {
      "sha256": "4b08c7332c2e3b96bf05a171d5f6e4de1a54fca09bcbf946446fd3f9c888ae3d",
      "bytes": 110735,
      "mime": "image/jpeg",
      "width": 1348,
      "height": 926,
      "content_address": "sha256/4b/4b08c7332c2e3b96bf05a171d5f6e4de1a54fca09bcbf946446fd3f9c888ae3d.jpg",
      "storage_status": "pending-private-storage"
    },
    "html": {
      "sha256": "6866ff203cab9ef4510497f89d1fb12f9f8aee4ecceb873cf19308d110d4a912",
      "bytes": 130842,
      "mime": "text/html",
      "content_address": "sha256/68/6866ff203cab9ef4510497f89d1fb12f9f8aee4ecceb873cf19308d110d4a912.html",
      "storage_status": "pending-private-storage"
    }
  },
  "content_hash": "6866ff203cab9ef4510497f89d1fb12f9f8aee4ecceb873cf19308d110d4a912",
  "rights": {
    "state": "third-party-reference-only",
    "allowed_use": "Abstract research findings and original pattern synthesis only.",
    "prohibited_use": "Marks, assets, font files, source code, distinctive compositions, and copied components.",
    "reviewed_at": "2026-09-02"
  },
  "provenance": {
    "source_owner": "Maven Learning, Inc.",
    "captured_by": "Codex design-research operator",
    "capture_purpose": "design-research-reference-only"
  },
  "inspection": {
    "menu_state": "not-tested",
    "motion_state": "observed",
    "reduced_motion": "not-tested",
    "accessibility_structure": "observed"
  }
}
