{
  "$schema": "../../../../schemas/design-snapshot-manifest.schema.json",
  "schema_version": "starlight.design_snapshot_manifest.v1",
  "snapshot_id": "snapshot.luma.feature.browser-observed.20260902t211727z",
  "target_id": "luma",
  "surface_id": "feature",
  "captured_at": "2026-09-02T21:17:27.365Z",
  "locale": "en",
  "url": "https://lu.ma/discover",
  "route": "/discover",
  "viewport": {
    "name": "browser-observed",
    "width": 1363,
    "height": 936,
    "dpr": 1
  },
  "tool": {
    "name": "codex-cloud-browser",
    "version": "2026-09-02",
    "method": "browser"
  },
  "response": {
    "status": null,
    "status_source": "browser-api-unavailable",
    "final_url": "https://luma.com/discover",
    "title": "Discover Events · Luma",
    "observed_page_state": "loaded"
  },
  "artifacts": {
    "screenshot": {
      "sha256": "1466867b1596444451dc41d398ff138f24c3f6642687463dcd57c8241b873aa5",
      "bytes": 81920,
      "mime": "image/jpeg",
      "width": 1348,
      "height": 926,
      "content_address": "sha256/14/1466867b1596444451dc41d398ff138f24c3f6642687463dcd57c8241b873aa5.jpg",
      "storage_status": "pending-private-storage"
    },
    "html": {
      "sha256": "77c05c64b0a0d43f131da0390142c0edaa6f1750dfcaf0e5795ff6d5658451e1",
      "bytes": 200246,
      "mime": "text/html",
      "content_address": "sha256/77/77c05c64b0a0d43f131da0390142c0edaa6f1750dfcaf0e5795ff6d5658451e1.html",
      "storage_status": "pending-private-storage"
    }
  },
  "content_hash": "77c05c64b0a0d43f131da0390142c0edaa6f1750dfcaf0e5795ff6d5658451e1",
  "rights": {
    "state": "third-party-reference-only",
    "allowed_use": "Abstract research findings and original pattern synthesis only.",
    "prohibited_use": "Marks, assets, font files, source code, distinctive compositions, and copied components.",
    "reviewed_at": "2026-09-02"
  },
  "provenance": {
    "source_owner": "Luma",
    "captured_by": "Codex design-research operator",
    "capture_purpose": "design-research-reference-only"
  },
  "inspection": {
    "menu_state": "not-tested",
    "motion_state": "observed",
    "reduced_motion": "not-tested",
    "accessibility_structure": "observed"
  }
}
