{
  "$schema": "../../../../schemas/design-snapshot-manifest.schema.json",
  "schema_version": "starlight.design_snapshot_manifest.v1",
  "snapshot_id": "snapshot.maven.product-overview.browser-observed.20260902t211404z",
  "target_id": "maven",
  "surface_id": "product-overview",
  "captured_at": "2026-09-02T21:14:04.185Z",
  "locale": "en",
  "url": "https://maven.com/courses",
  "route": "/courses",
  "viewport": {
    "name": "browser-observed",
    "width": 1363,
    "height": 936,
    "dpr": 1
  },
  "tool": {
    "name": "codex-cloud-browser",
    "version": "2026-09-02",
    "method": "browser"
  },
  "response": {
    "status": null,
    "status_source": "browser-api-unavailable",
    "final_url": "https://maven.com/courses",
    "title": "Cohort-based Courses",
    "observed_page_state": "loaded"
  },
  "artifacts": {
    "screenshot": {
      "sha256": "ad03571d643b3db2f50714711d323b084f3a49f1d29fdf1d4f6cb67eadc00be4",
      "bytes": 138432,
      "mime": "image/jpeg",
      "width": 1348,
      "height": 926,
      "content_address": "sha256/ad/ad03571d643b3db2f50714711d323b084f3a49f1d29fdf1d4f6cb67eadc00be4.jpg",
      "storage_status": "pending-private-storage"
    },
    "html": {
      "sha256": "b81830d1a428ec8a2fe24012cb75f4a9fcfbf3ae8f29a04926d706bd6a7fbe45",
      "bytes": 200031,
      "mime": "text/html",
      "content_address": "sha256/b8/b81830d1a428ec8a2fe24012cb75f4a9fcfbf3ae8f29a04926d706bd6a7fbe45.html",
      "storage_status": "pending-private-storage"
    }
  },
  "content_hash": "b81830d1a428ec8a2fe24012cb75f4a9fcfbf3ae8f29a04926d706bd6a7fbe45",
  "rights": {
    "state": "third-party-reference-only",
    "allowed_use": "Abstract research findings and original pattern synthesis only.",
    "prohibited_use": "Marks, assets, font files, source code, distinctive compositions, and copied components.",
    "reviewed_at": "2026-09-02"
  },
  "provenance": {
    "source_owner": "Maven Learning, Inc.",
    "captured_by": "Codex design-research operator",
    "capture_purpose": "design-research-reference-only"
  },
  "inspection": {
    "menu_state": "not-tested",
    "motion_state": "observed",
    "reduced_motion": "not-tested",
    "accessibility_structure": "observed"
  }
}
