{
  "$schema": "../../../../schemas/design-snapshot-manifest.schema.json",
  "schema_version": "starlight.design_snapshot_manifest.v1",
  "snapshot_id": "snapshot.reforge.feature.browser-observed.20260902t212404z",
  "target_id": "reforge",
  "surface_id": "feature",
  "captured_at": "2026-09-02T21:24:04.481Z",
  "locale": "en",
  "url": "https://www.reforge.com/courses/ai-productivity",
  "route": "/courses/ai-productivity",
  "viewport": {
    "name": "browser-observed",
    "width": 1363,
    "height": 936,
    "dpr": 1
  },
  "tool": {
    "name": "codex-cloud-browser",
    "version": "2026-09-02",
    "method": "browser"
  },
  "response": {
    "status": null,
    "status_source": "browser-api-unavailable",
    "final_url": "https://www.reforge.com/courses/ai-productivity",
    "title": "AI Productivity Course | Reforge",
    "observed_page_state": "loaded"
  },
  "artifacts": {
    "screenshot": {
      "sha256": "ee35352ea31d8870b5befb106668e2a0fcdc7a4dca0f94c493a91f3857fcc634",
      "bytes": 43751,
      "mime": "image/jpeg",
      "width": 1353,
      "height": 929,
      "content_address": "sha256/ee/ee35352ea31d8870b5befb106668e2a0fcdc7a4dca0f94c493a91f3857fcc634.jpg",
      "storage_status": "pending-private-storage"
    },
    "html": {
      "sha256": "7bfc1c8296a195067d83706a28a9ea6b1bbbcbf5891f34e5d8fcf9d603436e59",
      "bytes": 200015,
      "mime": "text/html",
      "content_address": "sha256/7b/7bfc1c8296a195067d83706a28a9ea6b1bbbcbf5891f34e5d8fcf9d603436e59.html",
      "storage_status": "pending-private-storage"
    }
  },
  "content_hash": "7bfc1c8296a195067d83706a28a9ea6b1bbbcbf5891f34e5d8fcf9d603436e59",
  "rights": {
    "state": "third-party-reference-only",
    "allowed_use": "Abstract research findings and original pattern synthesis only.",
    "prohibited_use": "Marks, assets, font files, source code, distinctive compositions, and copied components.",
    "reviewed_at": "2026-09-02"
  },
  "provenance": {
    "source_owner": "Reforge, Inc.",
    "captured_by": "Codex design-research operator",
    "capture_purpose": "design-research-reference-only"
  },
  "inspection": {
    "menu_state": "not-tested",
    "motion_state": "observed",
    "reduced_motion": "not-tested",
    "accessibility_structure": "observed"
  }
}
