{
  "$schema": "../../../../schemas/design-snapshot-manifest.schema.json",
  "schema_version": "starlight.design_snapshot_manifest.v1",
  "snapshot_id": "snapshot.league-universe.homepage.browser-observed.20260902t211534z",
  "target_id": "league-universe",
  "surface_id": "homepage",
  "captured_at": "2026-09-02T21:15:34.244Z",
  "locale": "en",
  "url": "https://universe.leagueoflegends.com/en_US/",
  "route": "/en_US/",
  "viewport": {
    "name": "browser-observed",
    "width": 1363,
    "height": 936,
    "dpr": 1
  },
  "tool": {
    "name": "codex-cloud-browser",
    "version": "2026-09-02",
    "method": "browser"
  },
  "response": {
    "status": null,
    "status_source": "browser-api-unavailable",
    "final_url": "https://universe.leagueoflegends.com/en_US/",
    "title": "Universe of League of Legends",
    "observed_page_state": "not-found-content"
  },
  "artifacts": {
    "screenshot": {
      "sha256": "07d2b93becd8481ece1f319faf4002b08b7158c06fe350d91e57b9f51e1aeb7c",
      "bytes": 10012,
      "mime": "image/jpeg",
      "width": 1348,
      "height": 926,
      "content_address": "sha256/07/07d2b93becd8481ece1f319faf4002b08b7158c06fe350d91e57b9f51e1aeb7c.jpg",
      "storage_status": "pending-private-storage"
    },
    "html": {
      "sha256": "bf5732e19cdcf9ddb11528f7da2c2dcf89ac009a165143f3eff2e199ed9eb286",
      "bytes": 25883,
      "mime": "text/html",
      "content_address": "sha256/bf/bf5732e19cdcf9ddb11528f7da2c2dcf89ac009a165143f3eff2e199ed9eb286.html",
      "storage_status": "pending-private-storage"
    }
  },
  "content_hash": "bf5732e19cdcf9ddb11528f7da2c2dcf89ac009a165143f3eff2e199ed9eb286",
  "rights": {
    "state": "third-party-reference-only",
    "allowed_use": "Abstract research findings and original pattern synthesis only.",
    "prohibited_use": "Marks, assets, font files, source code, distinctive compositions, and copied components.",
    "reviewed_at": "2026-09-02"
  },
  "provenance": {
    "source_owner": "Riot Games, Inc.",
    "captured_by": "Codex design-research operator",
    "capture_purpose": "design-research-reference-only"
  },
  "inspection": {
    "menu_state": "not-tested",
    "motion_state": "observed",
    "reduced_motion": "not-tested",
    "accessibility_structure": "observed"
  }
}
