{
  "$schema": "../../../../schemas/design-snapshot-manifest.schema.json",
  "schema_version": "starlight.design_snapshot_manifest.v1",
  "snapshot_id": "snapshot.othership.proof.browser-observed.20260902t211917z",
  "target_id": "othership",
  "surface_id": "proof",
  "captured_at": "2026-09-02T21:19:17.621Z",
  "locale": "en",
  "url": "https://www.othership.us/values",
  "route": "/values",
  "viewport": {
    "name": "browser-observed",
    "width": 1363,
    "height": 936,
    "dpr": 1
  },
  "tool": {
    "name": "codex-cloud-browser",
    "version": "2026-09-02",
    "method": "browser"
  },
  "response": {
    "status": null,
    "status_source": "browser-api-unavailable",
    "final_url": "https://www.othership.us/values",
    "title": "Values | Othership",
    "observed_page_state": "loaded"
  },
  "artifacts": {
    "screenshot": {
      "sha256": "e3efad64f0a7ef0866583351455f2effbb5dbde8d40679a0fdff2f9fba8133b5",
      "bytes": 88691,
      "mime": "image/jpeg",
      "width": 1353,
      "height": 929,
      "content_address": "sha256/e3/e3efad64f0a7ef0866583351455f2effbb5dbde8d40679a0fdff2f9fba8133b5.jpg",
      "storage_status": "pending-private-storage"
    },
    "html": {
      "sha256": "473f38079bf423ef37af7480e7bf94f7eb42f172c2d85ce241f174d1c9aa5c45",
      "bytes": 183304,
      "mime": "text/html",
      "content_address": "sha256/47/473f38079bf423ef37af7480e7bf94f7eb42f172c2d85ce241f174d1c9aa5c45.html",
      "storage_status": "pending-private-storage"
    }
  },
  "content_hash": "473f38079bf423ef37af7480e7bf94f7eb42f172c2d85ce241f174d1c9aa5c45",
  "rights": {
    "state": "third-party-reference-only",
    "allowed_use": "Abstract research findings and original pattern synthesis only.",
    "prohibited_use": "Marks, assets, font files, source code, distinctive compositions, and copied components.",
    "reviewed_at": "2026-09-02"
  },
  "provenance": {
    "source_owner": "Othership",
    "captured_by": "Codex design-research operator",
    "capture_purpose": "design-research-reference-only"
  },
  "inspection": {
    "menu_state": "not-tested",
    "motion_state": "observed",
    "reduced_motion": "not-tested",
    "accessibility_structure": "observed"
  }
}
