{
  "$schema": "../../../../schemas/design-snapshot-manifest.schema.json",
  "schema_version": "starlight.design_snapshot_manifest.v1",
  "snapshot_id": "snapshot.canva.homepage.browser-observed.20260902t210821z",
  "target_id": "canva",
  "surface_id": "homepage",
  "captured_at": "2026-09-02T21:08:21.582Z",
  "locale": "en",
  "url": "https://www.canva.com/",
  "route": "/",
  "viewport": {
    "name": "browser-observed",
    "width": 1363,
    "height": 936,
    "dpr": 1
  },
  "tool": {
    "name": "codex-cloud-browser",
    "version": "2026-09-02",
    "method": "browser"
  },
  "response": {
    "status": null,
    "status_source": "browser-api-unavailable",
    "final_url": "https://www.canva.com/",
    "title": "Canva: Visual Suite for Everyone",
    "observed_page_state": "loaded"
  },
  "artifacts": {
    "screenshot": {
      "sha256": "d5104bf7ed9ddcf5fb1a602ee2cf6f0e9c5a370dd04f5a91f4508c7243f95c87",
      "bytes": 94611,
      "mime": "image/jpeg",
      "width": 1348,
      "height": 926,
      "content_address": "sha256/d5/d5104bf7ed9ddcf5fb1a602ee2cf6f0e9c5a370dd04f5a91f4508c7243f95c87.jpg",
      "storage_status": "pending-private-storage"
    },
    "html": {
      "sha256": "b76eeae05750e36fb294d1157d7079cbd7e8e30db8f981aa632dd9253b03bc3e",
      "bytes": 200039,
      "mime": "text/html",
      "content_address": "sha256/b7/b76eeae05750e36fb294d1157d7079cbd7e8e30db8f981aa632dd9253b03bc3e.html",
      "storage_status": "pending-private-storage"
    }
  },
  "content_hash": "b76eeae05750e36fb294d1157d7079cbd7e8e30db8f981aa632dd9253b03bc3e",
  "rights": {
    "state": "third-party-reference-only",
    "allowed_use": "Abstract research findings and original pattern synthesis only.",
    "prohibited_use": "Marks, assets, font files, source code, distinctive compositions, and copied components.",
    "reviewed_at": "2026-09-02"
  },
  "provenance": {
    "source_owner": "Canva Pty Ltd",
    "captured_by": "Codex design-research operator",
    "capture_purpose": "design-research-reference-only"
  },
  "inspection": {
    "menu_state": "not-tested",
    "motion_state": "observed",
    "reduced_motion": "not-tested",
    "accessibility_structure": "observed"
  }
}
