{
  "$schema": "../../../../schemas/design-snapshot-manifest.schema.json",
  "schema_version": "starlight.design_snapshot_manifest.v1",
  "snapshot_id": "snapshot.canva.proof.browser-observed.20260902t210839z",
  "target_id": "canva",
  "surface_id": "proof",
  "captured_at": "2026-09-02T21:08:39.300Z",
  "locale": "en-US",
  "url": "https://www.canva.com/case-studies/",
  "route": "/case-studies/",
  "viewport": {
    "name": "browser-observed",
    "width": 1363,
    "height": 936,
    "dpr": 1
  },
  "tool": {
    "name": "codex-cloud-browser",
    "version": "2026-09-02",
    "method": "browser"
  },
  "response": {
    "status": null,
    "status_source": "browser-api-unavailable",
    "final_url": "https://www.canva.com/case-studies/",
    "title": "Canva customer case studies",
    "observed_page_state": "loaded"
  },
  "artifacts": {
    "screenshot": {
      "sha256": "06f6eec16058be395f73060084a87f33712f70259c8bd006f63495c078d44a3c",
      "bytes": 112377,
      "mime": "image/jpeg",
      "width": 1348,
      "height": 926,
      "content_address": "sha256/06/06f6eec16058be395f73060084a87f33712f70259c8bd006f63495c078d44a3c.jpg",
      "storage_status": "pending-private-storage"
    },
    "html": {
      "sha256": "43f338a78a4573cbf0447e2f4afe880eb176d2293f3421a6fe11e647d18ec7ae",
      "bytes": 200071,
      "mime": "text/html",
      "content_address": "sha256/43/43f338a78a4573cbf0447e2f4afe880eb176d2293f3421a6fe11e647d18ec7ae.html",
      "storage_status": "pending-private-storage"
    }
  },
  "content_hash": "43f338a78a4573cbf0447e2f4afe880eb176d2293f3421a6fe11e647d18ec7ae",
  "rights": {
    "state": "third-party-reference-only",
    "allowed_use": "Abstract research findings and original pattern synthesis only.",
    "prohibited_use": "Marks, assets, font files, source code, distinctive compositions, and copied components.",
    "reviewed_at": "2026-09-02"
  },
  "provenance": {
    "source_owner": "Canva Pty Ltd",
    "captured_by": "Codex design-research operator",
    "capture_purpose": "design-research-reference-only"
  },
  "inspection": {
    "menu_state": "not-tested",
    "motion_state": "observed",
    "reduced_motion": "not-tested",
    "accessibility_structure": "observed"
  }
}
