{
  "$schema": "../../../../schemas/design-snapshot-manifest.schema.json",
  "schema_version": "starlight.design_snapshot_manifest.v1",
  "snapshot_id": "snapshot.league-universe.product-overview.browser-observed.20260902t211547z",
  "target_id": "league-universe",
  "surface_id": "product-overview",
  "captured_at": "2026-09-02T21:15:47.564Z",
  "locale": "en",
  "url": "https://universe.leagueoflegends.com/en_US/champions/",
  "route": "/en_US/champions/",
  "viewport": {
    "name": "browser-observed",
    "width": 1363,
    "height": 936,
    "dpr": 1
  },
  "tool": {
    "name": "codex-cloud-browser",
    "version": "2026-09-02",
    "method": "browser"
  },
  "response": {
    "status": null,
    "status_source": "browser-api-unavailable",
    "final_url": "https://universe.leagueoflegends.com/en_US/champions/",
    "title": "Champions - Universe of League of Legends",
    "observed_page_state": "not-found-content"
  },
  "artifacts": {
    "screenshot": {
      "sha256": "69049381383b1740a41f8b6c2f6e3a8d40751a1c4796a98374ea49b2cdf57102",
      "bytes": 10114,
      "mime": "image/jpeg",
      "width": 1348,
      "height": 926,
      "content_address": "sha256/69/69049381383b1740a41f8b6c2f6e3a8d40751a1c4796a98374ea49b2cdf57102.jpg",
      "storage_status": "pending-private-storage"
    },
    "html": {
      "sha256": "b5b8e27a4796bbb212ede26999c850e9788a4ef99975f9d7025d4eeda7626a67",
      "bytes": 200014,
      "mime": "text/html",
      "content_address": "sha256/b5/b5b8e27a4796bbb212ede26999c850e9788a4ef99975f9d7025d4eeda7626a67.html",
      "storage_status": "pending-private-storage"
    }
  },
  "content_hash": "b5b8e27a4796bbb212ede26999c850e9788a4ef99975f9d7025d4eeda7626a67",
  "rights": {
    "state": "third-party-reference-only",
    "allowed_use": "Abstract research findings and original pattern synthesis only.",
    "prohibited_use": "Marks, assets, font files, source code, distinctive compositions, and copied components.",
    "reviewed_at": "2026-09-02"
  },
  "provenance": {
    "source_owner": "Riot Games, Inc.",
    "captured_by": "Codex design-research operator",
    "capture_purpose": "design-research-reference-only"
  },
  "inspection": {
    "menu_state": "not-tested",
    "motion_state": "observed",
    "reduced_motion": "not-tested",
    "accessibility_structure": "observed"
  }
}
