{
  "$schema": "../../../../schemas/design-snapshot-manifest.schema.json",
  "schema_version": "starlight.design_snapshot_manifest.v1",
  "snapshot_id": "snapshot.runway.feature.browser-observed.20260902t210603z",
  "target_id": "runway",
  "surface_id": "feature",
  "captured_at": "2026-09-02T21:06:03.587Z",
  "locale": "en",
  "url": "https://runway.com/research",
  "route": "/research",
  "viewport": {
    "name": "browser-observed",
    "width": 1363,
    "height": 936,
    "dpr": 1
  },
  "tool": {
    "name": "codex-cloud-browser",
    "version": "2026-09-02",
    "method": "browser"
  },
  "response": {
    "status": null,
    "status_source": "browser-api-unavailable",
    "final_url": "https://runway.com/research",
    "title": "AI Video Research & Innovation | Runway AI",
    "observed_page_state": "loaded"
  },
  "artifacts": {
    "screenshot": {
      "sha256": "5b89a381e44443116c7b370ee97eebbbb1bcffb3014618390f9f4d748eef44a9",
      "bytes": 95622,
      "mime": "image/jpeg",
      "width": 1348,
      "height": 926,
      "content_address": "sha256/5b/5b89a381e44443116c7b370ee97eebbbb1bcffb3014618390f9f4d748eef44a9.jpg",
      "storage_status": "pending-private-storage"
    },
    "html": {
      "sha256": "d908afccf18ba9e186a44c22ab4c5acc5c1720d37a80ebcf432b50f33af534c5",
      "bytes": 200061,
      "mime": "text/html",
      "content_address": "sha256/d9/d908afccf18ba9e186a44c22ab4c5acc5c1720d37a80ebcf432b50f33af534c5.html",
      "storage_status": "pending-private-storage"
    }
  },
  "content_hash": "d908afccf18ba9e186a44c22ab4c5acc5c1720d37a80ebcf432b50f33af534c5",
  "rights": {
    "state": "third-party-reference-only",
    "allowed_use": "Abstract research findings and original pattern synthesis only.",
    "prohibited_use": "Marks, assets, font files, source code, distinctive compositions, and copied components.",
    "reviewed_at": "2026-09-02"
  },
  "provenance": {
    "source_owner": "Runway AI, Inc.",
    "captured_by": "Codex design-research operator",
    "capture_purpose": "design-research-reference-only"
  },
  "inspection": {
    "menu_state": "not-tested",
    "motion_state": "observed",
    "reduced_motion": "not-tested",
    "accessibility_structure": "observed"
  }
}
