{
  "$schema": "../../../../schemas/design-snapshot-manifest.schema.json",
  "schema_version": "starlight.design_snapshot_manifest.v1",
  "snapshot_id": "snapshot.maven.pricing.browser-observed.20260902t211942z",
  "target_id": "maven",
  "surface_id": "pricing",
  "captured_at": "2026-09-02T21:19:42.573Z",
  "locale": "en",
  "url": "https://maven.com/signup",
  "route": "/signup",
  "viewport": {
    "name": "browser-observed",
    "width": 1363,
    "height": 936,
    "dpr": 1
  },
  "tool": {
    "name": "codex-cloud-browser",
    "version": "2026-09-02",
    "method": "browser"
  },
  "response": {
    "status": null,
    "status_source": "browser-api-unavailable",
    "final_url": "https://maven.com/signup",
    "title": "Signup for Maven | Maven | Unlock your career growth",
    "observed_page_state": "loaded"
  },
  "artifacts": {
    "screenshot": {
      "sha256": "e19ccdd351eab377f56c58b068126bf59449a70be0cf1656f662b92d7c9a42ab",
      "bytes": 34267,
      "mime": "image/jpeg",
      "width": 1363,
      "height": 936,
      "content_address": "sha256/e1/e19ccdd351eab377f56c58b068126bf59449a70be0cf1656f662b92d7c9a42ab.jpg",
      "storage_status": "pending-private-storage"
    },
    "html": {
      "sha256": "e1342ddf428dedb248d0bea59c8bae8d356ce6067b4e84c6f5fdf31ef2e43b32",
      "bytes": 83967,
      "mime": "text/html",
      "content_address": "sha256/e1/e1342ddf428dedb248d0bea59c8bae8d356ce6067b4e84c6f5fdf31ef2e43b32.html",
      "storage_status": "pending-private-storage"
    }
  },
  "content_hash": "e1342ddf428dedb248d0bea59c8bae8d356ce6067b4e84c6f5fdf31ef2e43b32",
  "rights": {
    "state": "third-party-reference-only",
    "allowed_use": "Abstract research findings and original pattern synthesis only.",
    "prohibited_use": "Marks, assets, font files, source code, distinctive compositions, and copied components.",
    "reviewed_at": "2026-09-02"
  },
  "provenance": {
    "source_owner": "Maven Learning, Inc.",
    "captured_by": "Codex design-research operator",
    "capture_purpose": "design-research-reference-only"
  },
  "inspection": {
    "menu_state": "not-tested",
    "motion_state": "observed",
    "reduced_motion": "not-tested",
    "accessibility_structure": "observed"
  }
}
