{
  "$schema": "../../../../schemas/design-snapshot-manifest.schema.json",
  "schema_version": "starlight.design_snapshot_manifest.v1",
  "snapshot_id": "snapshot.vercel.homepage.browser-observed.20260902t210111z",
  "target_id": "vercel",
  "surface_id": "homepage",
  "captured_at": "2026-09-02T21:01:11.172Z",
  "locale": "en",
  "url": "https://vercel.com/",
  "route": "/",
  "viewport": {
    "name": "browser-observed",
    "width": 1363,
    "height": 936,
    "dpr": 1
  },
  "tool": {
    "name": "codex-cloud-browser",
    "version": "2026-09-02",
    "method": "browser"
  },
  "response": {
    "status": null,
    "status_source": "browser-api-unavailable",
    "final_url": "https://vercel.com/",
    "title": "Agentic Infrastructure - Vercel",
    "observed_page_state": "loaded"
  },
  "artifacts": {
    "screenshot": {
      "sha256": "d61bf6e0401a9678a1efef9b1b7fe0d9b271878a6686d9056c0a3731096bcad4",
      "bytes": 41148,
      "mime": "image/jpeg",
      "width": 1348,
      "height": 926,
      "content_address": "sha256/d6/d61bf6e0401a9678a1efef9b1b7fe0d9b271878a6686d9056c0a3731096bcad4.jpg",
      "storage_status": "pending-private-storage"
    },
    "html": {
      "sha256": "d9745eae00bb51e5d592cbd9e90d6eacb10093febffa8bc87bc05e313ca8305a",
      "bytes": 200025,
      "mime": "text/html",
      "content_address": "sha256/d9/d9745eae00bb51e5d592cbd9e90d6eacb10093febffa8bc87bc05e313ca8305a.html",
      "storage_status": "pending-private-storage"
    }
  },
  "content_hash": "d9745eae00bb51e5d592cbd9e90d6eacb10093febffa8bc87bc05e313ca8305a",
  "rights": {
    "state": "third-party-reference-only",
    "allowed_use": "Abstract research findings and original pattern synthesis only.",
    "prohibited_use": "Marks, assets, font files, source code, distinctive compositions, and copied components.",
    "reviewed_at": "2026-09-02"
  },
  "provenance": {
    "source_owner": "Vercel Inc.",
    "captured_by": "Codex design-research operator",
    "capture_purpose": "design-research-reference-only"
  },
  "inspection": {
    "menu_state": "not-tested",
    "motion_state": "observed",
    "reduced_motion": "not-tested",
    "accessibility_structure": "observed"
  }
}
