{
  "$schema": "../../../../schemas/design-snapshot-manifest.schema.json",
  "schema_version": "starlight.design_snapshot_manifest.v1",
  "snapshot_id": "snapshot.vercel.feature.browser-observed.20260902t210128z",
  "target_id": "vercel",
  "surface_id": "feature",
  "captured_at": "2026-09-02T21:01:28.114Z",
  "locale": "en",
  "url": "https://vercel.com/ai",
  "route": "/ai",
  "viewport": {
    "name": "browser-observed",
    "width": 1363,
    "height": 936,
    "dpr": 1
  },
  "tool": {
    "name": "codex-cloud-browser",
    "version": "2026-09-02",
    "method": "browser"
  },
  "response": {
    "status": null,
    "status_source": "browser-api-unavailable",
    "final_url": "https://vercel.com/ai",
    "title": "Deploy AI at the speed of frontend",
    "observed_page_state": "loaded"
  },
  "artifacts": {
    "screenshot": {
      "sha256": "edee15f3194bceeb6964ada9c54787faaab1911b0891af4bfd4c1e0cf854e171",
      "bytes": 59304,
      "mime": "image/jpeg",
      "width": 1348,
      "height": 926,
      "content_address": "sha256/ed/edee15f3194bceeb6964ada9c54787faaab1911b0891af4bfd4c1e0cf854e171.jpg",
      "storage_status": "pending-private-storage"
    },
    "html": {
      "sha256": "84635e0d840cc6acf9e10a4c2f8e75b9e9e92a089df2ae47ba901073913bc2ac",
      "bytes": 200027,
      "mime": "text/html",
      "content_address": "sha256/84/84635e0d840cc6acf9e10a4c2f8e75b9e9e92a089df2ae47ba901073913bc2ac.html",
      "storage_status": "pending-private-storage"
    }
  },
  "content_hash": "84635e0d840cc6acf9e10a4c2f8e75b9e9e92a089df2ae47ba901073913bc2ac",
  "rights": {
    "state": "third-party-reference-only",
    "allowed_use": "Abstract research findings and original pattern synthesis only.",
    "prohibited_use": "Marks, assets, font files, source code, distinctive compositions, and copied components.",
    "reviewed_at": "2026-09-02"
  },
  "provenance": {
    "source_owner": "Vercel Inc.",
    "captured_by": "Codex design-research operator",
    "capture_purpose": "design-research-reference-only"
  },
  "inspection": {
    "menu_state": "not-tested",
    "motion_state": "observed",
    "reduced_motion": "not-tested",
    "accessibility_structure": "observed"
  }
}
