{
  "$schema": "../../../../schemas/design-snapshot-manifest.schema.json",
  "schema_version": "starlight.design_snapshot_manifest.v1",
  "snapshot_id": "snapshot.canva.feature.browser-observed.20260902t210835z",
  "target_id": "canva",
  "surface_id": "feature",
  "captured_at": "2026-09-02T21:08:35.125Z",
  "locale": "en",
  "url": "https://www.canva.com/ai-image-generator/",
  "route": "/ai-image-generator/",
  "viewport": {
    "name": "browser-observed",
    "width": 1363,
    "height": 936,
    "dpr": 1
  },
  "tool": {
    "name": "codex-cloud-browser",
    "version": "2026-09-02",
    "method": "browser"
  },
  "response": {
    "status": null,
    "status_source": "browser-api-unavailable",
    "final_url": "https://www.canva.com/ai-image-generator/",
    "title": "Free AI Image Generator: Text to Image | Canva",
    "observed_page_state": "loaded"
  },
  "artifacts": {
    "screenshot": {
      "sha256": "e814cf7554578d4d08217bf7a20f605734a3e9a0ec7fe4cefdab51db4b724b1c",
      "bytes": 73187,
      "mime": "image/jpeg",
      "width": 1348,
      "height": 926,
      "content_address": "sha256/e8/e814cf7554578d4d08217bf7a20f605734a3e9a0ec7fe4cefdab51db4b724b1c.jpg",
      "storage_status": "pending-private-storage"
    },
    "html": {
      "sha256": "06c79d77390279bbb3b41ac96409d3b1e1fcf8c460548edacf894a6d0ddd2ef0",
      "bytes": 200173,
      "mime": "text/html",
      "content_address": "sha256/06/06c79d77390279bbb3b41ac96409d3b1e1fcf8c460548edacf894a6d0ddd2ef0.html",
      "storage_status": "pending-private-storage"
    }
  },
  "content_hash": "06c79d77390279bbb3b41ac96409d3b1e1fcf8c460548edacf894a6d0ddd2ef0",
  "rights": {
    "state": "third-party-reference-only",
    "allowed_use": "Abstract research findings and original pattern synthesis only.",
    "prohibited_use": "Marks, assets, font files, source code, distinctive compositions, and copied components.",
    "reviewed_at": "2026-09-02"
  },
  "provenance": {
    "source_owner": "Canva Pty Ltd",
    "captured_by": "Codex design-research operator",
    "capture_purpose": "design-research-reference-only"
  },
  "inspection": {
    "menu_state": "not-tested",
    "motion_state": "observed",
    "reduced_motion": "not-tested",
    "accessibility_structure": "observed"
  }
}
