{
  "$schema": "../../../../schemas/design-snapshot-manifest.schema.json",
  "schema_version": "starlight.design_snapshot_manifest.v1",
  "snapshot_id": "snapshot.linear.proof.browser-observed.20260902t205939z",
  "target_id": "linear",
  "surface_id": "proof",
  "captured_at": "2026-09-02T20:59:39.577Z",
  "locale": "en",
  "url": "https://linear.app/customers",
  "route": "/customers",
  "viewport": {
    "name": "browser-observed",
    "width": 1363,
    "height": 936,
    "dpr": 1
  },
  "tool": {
    "name": "codex-cloud-browser",
    "version": "2026-09-02",
    "method": "browser"
  },
  "response": {
    "status": null,
    "status_source": "browser-api-unavailable",
    "final_url": "https://linear.app/customers",
    "title": "Linear Customers",
    "observed_page_state": "loaded"
  },
  "artifacts": {
    "screenshot": {
      "sha256": "6d85db0ef2dff11ce15e9d84fa7dc5c88b66ee06ef6853bec280f513d3f4ef13",
      "bytes": 91291,
      "mime": "image/jpeg",
      "width": 1348,
      "height": 926,
      "content_address": "sha256/6d/6d85db0ef2dff11ce15e9d84fa7dc5c88b66ee06ef6853bec280f513d3f4ef13.jpg",
      "storage_status": "pending-private-storage"
    },
    "html": {
      "sha256": "98c837944c93876249ae6fed33b85f14dd2e015434c040c05b5fafa71a2e3a9f",
      "bytes": 200085,
      "mime": "text/html",
      "content_address": "sha256/98/98c837944c93876249ae6fed33b85f14dd2e015434c040c05b5fafa71a2e3a9f.html",
      "storage_status": "pending-private-storage"
    }
  },
  "content_hash": "98c837944c93876249ae6fed33b85f14dd2e015434c040c05b5fafa71a2e3a9f",
  "rights": {
    "state": "third-party-reference-only",
    "allowed_use": "Abstract research findings and original pattern synthesis only.",
    "prohibited_use": "Marks, assets, font files, source code, distinctive compositions, and copied components.",
    "reviewed_at": "2026-09-02"
  },
  "provenance": {
    "source_owner": "Linear Orbit, Inc.",
    "captured_by": "Codex design-research operator",
    "capture_purpose": "design-research-reference-only"
  },
  "inspection": {
    "menu_state": "not-tested",
    "motion_state": "observed",
    "reduced_motion": "not-tested",
    "accessibility_structure": "observed"
  }
}
