{
  "$schema": "../../../../schemas/design-snapshot-manifest.schema.json",
  "schema_version": "starlight.design_snapshot_manifest.v1",
  "snapshot_id": "snapshot.beehiiv.feature.browser-observed.20260902t212451z",
  "target_id": "beehiiv",
  "surface_id": "feature",
  "captured_at": "2026-09-02T21:24:51.147Z",
  "locale": "en-us",
  "url": "https://www.beehiiv.com/features/web-builder",
  "route": "/features/web-builder",
  "viewport": {
    "name": "browser-observed",
    "width": 1363,
    "height": 936,
    "dpr": 1
  },
  "tool": {
    "name": "codex-cloud-browser",
    "version": "2026-09-02",
    "method": "browser"
  },
  "response": {
    "status": null,
    "status_source": "browser-api-unavailable",
    "final_url": "https://www.beehiiv.com/features/web-builder",
    "title": "AI Website Builder - beehiiv",
    "observed_page_state": "loaded"
  },
  "artifacts": {
    "screenshot": {
      "sha256": "510df25756f6a6a5eb0d800b30d484361373c9d1b056b9b27fb56725993e1768",
      "bytes": 119524,
      "mime": "image/jpeg",
      "width": 1348,
      "height": 926,
      "content_address": "sha256/51/510df25756f6a6a5eb0d800b30d484361373c9d1b056b9b27fb56725993e1768.jpg",
      "storage_status": "pending-private-storage"
    },
    "html": {
      "sha256": "785e3b2e8a245d108bd362fb5a666ab22cadc0aa528475f3ae94971db2edbea8",
      "bytes": 200017,
      "mime": "text/html",
      "content_address": "sha256/78/785e3b2e8a245d108bd362fb5a666ab22cadc0aa528475f3ae94971db2edbea8.html",
      "storage_status": "pending-private-storage"
    }
  },
  "content_hash": "785e3b2e8a245d108bd362fb5a666ab22cadc0aa528475f3ae94971db2edbea8",
  "rights": {
    "state": "third-party-reference-only",
    "allowed_use": "Abstract research findings and original pattern synthesis only.",
    "prohibited_use": "Marks, assets, font files, source code, distinctive compositions, and copied components.",
    "reviewed_at": "2026-09-02"
  },
  "provenance": {
    "source_owner": "beehiiv, Inc.",
    "captured_by": "Codex design-research operator",
    "capture_purpose": "design-research-reference-only"
  },
  "inspection": {
    "menu_state": "not-tested",
    "motion_state": "observed",
    "reduced_motion": "not-tested",
    "accessibility_structure": "observed"
  }
}
